{
  "$schema": "https://raw.githubusercontent.com/JinHanAI/china-llm-api-pricing/main/schema-v1.json",
  "asOf": "2026-08-23",
  "currency": "USD",
  "unit": "per 1M tokens (input/output)",
  "disclaimer": "Community-maintained mirror of official list prices. Prices change weekly — always verify against the vendor docs linked in each entry before committing to spend.",
  "models": [
    {
      "id": "glm-5.3",
      "vendor": "Zhipu AI / Z.ai",
      "input": 1.40,
      "cachedInput": 0.26,
      "output": 4.40,
      "context": "1M",
      "status": "GA (API since 2026-08-19)",
      "source": "https://docs.z.ai/guides/overview/pricing"
    },
    {
      "id": "glm-5.2",
      "vendor": "Zhipu AI / Z.ai",
      "input": 1.40,
      "cachedInput": 0.26,
      "output": 4.40,
      "context": "1M",
      "status": "GA",
      "source": "https://docs.z.ai/guides/overview/pricing"
    },
    {
      "id": "qwen3.8-max",
      "vendor": "Alibaba",
      "input": 2.00,
      "output": 6.00,
      "context": "256K+",
      "status": "GA (Model Studio)",
      "source": "https://www.alibabacloud.com/help/en/model-studio/models"
    },
    {
      "id": "qwen3.5-flash",
      "vendor": "Alibaba",
      "input": 0.029,
      "output": null,
      "context": null,
      "note": "cheapest input price observed; output price not yet verified — pending",
      "source": "https://www.llmabacus.com/en/chinese-llm-api-pricing"
    },
    {
      "id": "deepseek-v4-flash",
      "vendor": "DeepSeek",
      "input": 0.14,
      "output": 0.28,
      "context": null,
      "status": "GA",
      "source": "https://www.morphllm.com/llm-api"
    },
    {
      "id": "deepseek-v4-pro",
      "vendor": "DeepSeek",
      "input": null,
      "output": 0.87,
      "context": null,
      "note": "cheapest frontier output price observed; input price pending",
      "source": "https://apidog.com/blog/chinese-llm-price-war-2026/"
    },
    {
      "id": "kimi-k3",
      "vendor": "Moonshot AI",
      "input": 3.00,
      "cachedInput": 0.30,
      "output": 15.00,
      "context": "1M",
      "status": "GA",
      "source": "https://platform.kimi.ai/"
    },
    {
      "id": "kimi-k2.5",
      "vendor": "Moonshot AI",
      "input": 0.45,
      "output": 2.25,
      "context": "262K",
      "status": "GA",
      "source": "https://openrouter.ai/moonshotai/kimi-k2.5"
    },
    {
      "id": "minimax-m3",
      "vendor": "MiniMax",
      "input": 0.60,
      "output": 2.40,
      "context": null,
      "note": "cheapest model scoring >80% on SWE-bench (per MorphLLM)",
      "source": "https://www.morphllm.com/llm-api"
    },
    {
      "id": "mimo-v2.5-pro",
      "vendor": "Xiaomi",
      "input": null,
      "output": 3.00,
      "context": "1M",
      "note": "flat output price at 1M context",
      "source": "https://apidog.com/blog/chinese-llm-price-war-2026/"
    }
  ],
  "videoModels": [
    {
      "id": "happyhorse-1.1",
      "vendor": "Alibaba",
      "unit": "per second (720p / 1080p)",
      "price": "0.0988 / 0.1278",
      "source": "https://openrouter.ai/alibaba/happyhorse-1.1"
    },
    {
      "id": "seedance-2.5",
      "vendor": "ByteDance",
      "unit": "per second (480p / 720p)",
      "price": "~0.10 / ~0.23",
      "source": "Volcano Ark (2026-08-07 GA)"
    }
  ]
}
